{
  "eventId": "018f3d7d-09b1-7a36-b1d8-b8f915c62a17",
  "eventType": "platform.probe.requested.v0",
  "eventVersion": 0,
  "occurredAt": "2026-07-17T12:00:00Z",
  "producer": "liqi-api",
  "correlationId": "018f3d7d-09b1-7a36-b1d8-b8f915c62a18",
  "causationId": "018f3d7d-09b1-7a36-b1d8-b8f915c62a19",
  "aggregateKey": "platform-probe:018f3d7d-09b1-7a36-b1d8-b8f915c62a20",
  "orderingKey": "platform-probe:018f3d7d-09b1-7a36-b1d8-b8f915c62a20",
  "payload": {
    "probeId": "018f3d7d-09b1-7a36-b1d8-b8f915c62a20"
  },
  "metadata": {
    "environment": "test"
  }
}
